<?xml version="1.0" encoding="UTF-8"?>
<tns:Profile KeyId="1" Name="Admin" xmlns:tns="http://www.example.org/Profile" xmlns:tns1="http://www.example.org/PMOTask" xmlns:xsi="http://www.w3.org/2001/XMLSchema-instance" xsi:schemaLocation="http://www.example.org/Profile Profile.xsd ">
  
  <tns:Resources>
    <tns:resource>
      <tns:Credentials>
        <tns:rights>CREATE</tns:rights>
        <tns:rights>READ</tns:rights>
        <tns:rights>UPDATE</tns:rights>
        <tns:rights>DELETE</tns:rights>
      </tns:Credentials>      
      <tns:Path>admin/credAdmin.faces</tns:Path>
      <tns:Description>Admin page</tns:Description>
    </tns:resource>
    <tns:resource>
      <tns:Credentials>
        <tns:rights>CREATE</tns:rights>
        <tns:rights>READ</tns:rights>
        <tns:rights>UPDATE</tns:rights>
        <tns:rights>DELETE</tns:rights>
      </tns:Credentials>      
      <tns:Path>credPM.faces</tns:Path>
      <tns:Description>Project page</tns:Description>
    </tns:resource>
  </tns:Resources>
  <tns:Description>tns1:Description</tns:Description>
</tns:Profile>
