<?xml version="1.0" encoding="UTF-8"?>
<tns:Profile KeyId="" Name="" xmlns:tns="http://www.example.org/Profile" xmlns:xsi="http://www.w3.org/2001/XMLSchema-instance" xsi:schemaLocation="http://www.example.org/Profile ../../projects/model/Profile.xsd ">
	<tns:Resources>
    <tns:resource>
      <tns:Credentials>
        <tns:rights>CREATE</tns:rights>
        <tns:rights>READ</tns:rights>
        <tns:rights>UPDATE</tns:rights>
        <tns:rights>DELETE</tns:rights>
      </tns:Credentials>      
      <tns:Path>Default.jsp</tns:Path>
      <tns:Description>Anonymous View</tns:Description>
    </tns:resource>
    <tns:resource>
      <tns:Credentials>
        <tns:rights>CREATE</tns:rights>
        <tns:rights>READ</tns:rights>
        <tns:rights>UPDATE</tns:rights>
        <tns:rights>DELETE</tns:rights>
      </tns:Credentials>      
      <tns:Path>help/help.jsp</tns:Path>
      <tns:Description>Help Page</tns:Description>
    </tns:resource>
  </tns:Resources>
  <tns:Description>Anonymous setup</tns:Description>
</tns:Profile>
